{
  "schema_version": 1,
  "session_id": "hash-valid-feature-2026-04-23",
  "slug": "hash-valid-feature",
  "status": "active",
  "started_at": "2026-04-23T12:00:00Z",
  "last_checkpoint_at": "2026-04-23T12:00:00Z",
  "active_skill": "work-review",
  "baseline_hash": "2340d8aab09c3cf9800318695e993a698487e75625207ea62561f47dce262da7"
}
