{
  "schema_version": 1,
  "session_id": "routing-with-baseline-2026-04-23",
  "slug": "routing-with-baseline",
  "status": "active",
  "started_at": "2026-04-23T12:00:00Z",
  "last_checkpoint_at": "2026-04-23T12:30:00Z",
  "active_skill": "work-implementation",
  "baseline_hash": "0000000000000000000000000000000000000000000000000000000000000000"
}
