{
  "schema_version": 1,
  "session_id": "refactor-rigor-gradient-pipeline-2026-04-23",
  "slug": "refactor-rigor-gradient-pipeline",
  "status": "active",
  "started_at": "2026-04-23T12:00:00Z",
  "last_checkpoint_at": "2026-04-23T12:30:00Z",
  "active_skill": "work-implementation",
  "baseline_hash": "e3b0c44298fc1c149afbf4c8996fb92427ae41e4649b934ca495991b7852b855"
}
